name,title,comment,commenter,lat,lon,percent,resolution
ESP_047180_1375,Contact near Reull Vallis,no (looks sublimation-related),Alex,-42.215417,105.419035,7.12,0.25
ESP_047223_1345,Mid-latitude terrain sample,no,Alex,-45.097614,12.1947301,5.28,0.25
ESP_047346_1365,Fresh small crater in Icaria Planum,maybe,Alex,-43.078405,253.457733,5.22,0.25
ESP_047822_1380,Branched channels in Terra Sirenum,-41.533164,216.623163,2.36,0.25
ESP_048166_2100,Cratered cones in Phlegra region,29.5114427,174.40015,3.09,0.25
ESP_048851_2190,Candidate Red Dragon landing site in southern,yes,Alex,38.7364699,190.297841,4.43,0.25
ESP_048949_2230,Surface of debris apron north of Arabia region,yes,Alex,42.8956322,34.0723393,11.88,0.25
ESP_049291_2220,Flow in Protonilus Mensae,maybe - bottom,Kyle,41.5604435,56.2473204,4.12,0.25
ESP_049306_2160,Exit breach in well-preserved crater,yes,Alex,35.7996932,7.54838855,2.26,0.25
ESP_049502_2230,Pits near trough in Protonilus Mensae,yes,Alex,42.528051,55.6776573,9.88,0.25
ESP_049555_2225,Tongue-shaped flow feature in Protonilus Mensae,yes,Alex,42.1112112,49.5780035,6.93,0.25
ESP_049568_2185,Lineated valley floor material in the Coloe,yes,Alex,38.3826644,56.1137774,11.27,0.5
ESP_049841_2150,Ridged surfaces near Phlegra Montes,maybe. Parallel ridges do mimick b.c. terrain but unclear whether it's actually that (Alex: yes),Eldar (Alex),34.540803,164.047325,24.6,0.5
ESP_050255_2195,Breached crater rim,yes,Alex,38.9165652,20.4275139,3.46,0.25
ESP_050447_1395,Valleys and Electris deposit in southern Gorgonum,no,Alex,-40.130585,187.397832,3.5,0.25
ESP_050473_2200,Flow features in Erebus Montes,yes,Alex,39.4911423,187.961671,7.5,0.25
ESP_050769_2210,Cirque valley drainage system,maybe the the southern part of the NE area,Alex,40.8712288,26.2478232,2.02,0.25
ESP_050901_2210,Impact crater and ejecta partially buried by,no but i can see how it would get confused (Alex: I would say yes for the area SW of the large central crater),Eldar (Alex),40.6002309,21.0855138,6.33,0.25
ESP_051256_2220,Crater monitoring,yes,Alex,41.4414686,48.7753096,31.17,0.25
ESP_051264_2195,Plains near Erebus Montes,yes,Alex,39.1839829,190.533335,28.72,0.25
ESP_051942_2210,Lineated valley floor material in terrain north,yes,Alex,40.5867573,42.0128017,2.84,0.5
ESP_052385_2205,Sample region near Erebus Montes,yes and pretty fine,Eldar,40.1702267,186.334778,37.55,0.25
ESP_052569_2200,Crater monitoring,yes,Alex,39.5463869,202.427135,4.67,0.25
ESP_052602_2140,Brain terrain north of Cerulli Crater,yes,Eldar,33.7155737,22.1833001,15.7,0.25
ESP_052675_2215,Region near Erebus Montes,yes and pretty fine,Eldar,41.0761421,188.433393,31.61,0.25
ESP_053483_2220,Deposits in crater in Utopia Planitia,yes,Eldar,41.4772242,87.7191039,13.45,0.25
ESP_053630_2195,Lineated valley fill north of Arabia region,yes,Alex,39.3750086,34.8894328,3.81,0.25
ESP_053656_2205,Brain terrain south of Moreux Crater,maybe,Alex,40.0808514,44.1963578,3.94,0.25
ESP_053694_2240,Scalloped depression,(no samples identified)43.5745234,85.9459434,4.37,0.25
ESP_053868_2175,Layered features in brain terrain in Arabia,yes,Alex,37.0144924,17.8760095,15.9,0.25
ESP_053870_2235,Pitted cones on ridge in Chryse Planitia,no,Alex,43.3811674,320.27128,24.72,0.25
ESP_053936_2235,Pitted cones on ridge in Chryse Planitia,yes (Alex: no),Eldar (Alex),43.3828632,320.271983,28.91,0.25
ESP_053954_2230,Crater monitoring,no,Kyle,42.576487,189.019764,14.43,0.25
ESP_054508_2160,West of Erebus Montes,no,Alex,35.7121074,184.318671,15.17,0.25
ESP_054526_2220,Glacial-like flow on mound in Protonilus Mensae,yes,Eldar,41.7680945,51.9475487,22.2,0.25
ESP_054798_2180,West of Erebus Montes,Maybe. Craters in this image has a weird central ring (Alex: yes),Eldar (Alex),37.81387,186.951516,5.88,0.25
ESP_054804_2190,Lineated valley flow into lobate debris apron in,yes,Alex,38.1214452,23.1238101,15.43,0.5
ESP_054843_2100,Crater wall and floor,yes,Alex,29.6914458,39.5849031,19.72,0.5
ESP_054897_2160,Floor features of northern mid-latitude crater,maybe,Alex,35.6910321,4.60226512,8.21,0.25
ESP_054935_2220,Variety of brain terrain near east rim of Moreux,yes. Possibly a good candidate for evidence of sublimation origin hypothesis,Eldar,41.7827681,46.2201292,16.81,0.25
ESP_054936_2180,Possible flow material in Mamers Valles,yes,Alex,37.4622796,19.6610363,45.29,0.25
ESP_055009_2175,Western Erebus Montes,Very degraded,Alex,37.2875629,186.814244,6.97,0.25
ESP_055014_2265,Protonilus Mensae debris-covered apron,Partially. Fine-scale,Alex,45.9284527,48.8775235,4.25,0.5
ESP_055027_2250,Cracks along mound in Protonilus Mensae,Partially. Some brain coral but some definitely not brain coral,Alex,44.7732564,54.1808426,12.33,0.25
ESP_055068_2200,Lineated valley fill north of Arabia region,yes,Alex,39.7572603,15.796181,68.7,0.25
ESP_055080_2205,Crater floor features in Protonilus Mensae,yes,Alex,40.1050012,48.0930573,12.78,0.25
ESP_055146_2220,Candidate recent impact site,yes,Alex,41.4487647,48.7675334,35.49,0.25
ESP_055212_2195,Old glacier with possible marginal ridge south of,no,Alex,39.407474,44.7425802,2.72,0.25
ESP_055220_2185,West of Erebus Montes,no,Alex,38.2337104,186.586592,24.36,0.25
ESP_055278_2195,Confluence of channels near Ismeniae Fossae,no,Kyle,38.9294438,43.9549814,4.78,0.5
ESP_055359_1800,Meridiani Planum stratigraphy,no (TARs),Alex,-0.3100854,-0.9118952,5.91,0.5
ESP_055383_2135,Candidate recent impact site,no,Alex,33.1884549,58.0668516,4.05,0.25
ESP_055536_2205,Bedforms in crater in Amazonis Planitia,Maybe. Definitely some split ridges,Alex,39.9840185,202.603459,2.99,0.25
ESP_055547_1390,Terrain sample,no,Alex,-40.605608,270.427988,8.6,0.25
ESP_055582_1365,Tongue-shaped flow in Rabe Crater,no,Alex,-43.319654,35.8938341,5.04,0.25
ESP_056642_1370,Flow along crater wall in Claritas Fossae region,yes,Alex,-42.451508,263.043158,5.27,0.25
ESP_056736_1395,Gully monitoring,no,Alex,-40.288958,217.071639,2.29,0.25
ESP_056852_2200,Ascuris Planum,no,Alex,39.9045761,279.878893,3.71,0.5
ESP_056928_1065,Southern Noachis Terra,no,Alex,-73.337892,24.112372,2.21,0.25
ESP_056961_2170,Landforms west of Erebus Montes,no,Alex,36.744192,185.609955,17.22,0.5
ESP_056966_2220,Crater monitoring,yes,Alex,41.4480314,48.7748365,3.14,0.25
ESP_057012_1405,Mantle layers in Icaria Fossae,unlikely. But interesting erosional patterns in the crater floor (Alex: maybe yes. Widely spaced),Eldar,-38.943424,242.973502,3.02,0.25
ESP_057053_1405,Mid-latitude terrain sample,no,Alex,-39.405614,204.381544,2.03,0.25
ESP_057263_1375,Terra Sirenum crater infill,yes,Alex,-41.961356,230.562522,3.02,0.25
ESP_057317_2210,Crater with preferential ejecta distribution on,"Mostly yes, but some false detections",Alex,40.8225556,188.940535,32.25,0.25
ESP_057318_2140,Crater with concentric crater fill in Phlegra,maybe,Alex,33.9082601,163.032946,2.27,0.25
ESP_057357_2225,Phlegra Dorsa,"Mostly yes, but some false detections",Alex,41.9720383,176.47938,42.78,0.25
ESP_057515_2160,Erebus Montes,no,Alex,35.7422299,185.200641,20.72,0.25
ESP_057599_2240,Pits forming lines in Protonilus Mensae,43.4663668,51.4138911,7.24,0.25
ESP_057797_2220,Flow with odd shape in northern mid-latitudes,maybe (Alex: yes),Kyle (Alex),41.4880394,49.0164946,7.23,0.25
ESP_057806_2155,Crater floor in Phlegra Montes,34.9767153,164.395177,2.15,0.25
ESP_057863_2200,Flows in northern mid-latitudes,39.5289608,46.6316119,2.83,0.25
ESP_058061_2195,Terrain south of Moreux Crater,no,Alex,39.274098,43.931649,3.45,0.25
ESP_058153_2255,Pits forming lines in Protonilus Mensae,yes,Alex,45.1602708,51.076561,3.02,0.25
ESP_058584_2155,Smooth area in Phlegra Montes,no,Alex,35.2291475,163.953915,21.83,0.25
ESP_058641_2230,Variety of brain terrain near east rim of Moreux,yes,Alex,42.4709649,46.2342133,3.6,0.25
ESP_058650_2130,Plains in Phlegra Montes,no (or perhaps very degraded),Alex,32.8131468,162.012871,12.51,0.25
ESP_058795_2155,Smooth area in Phlegra Montes,no,Alex,35.2340526,163.953765,5.89,0.25
ESP_058874_2160,Potential landing site in Phlegra Montes,no,Alex,35.8497648,164.037504,4.87,0.25
ESP_059234_2185,Lineated valley floor material in Coloe Fossae,maybe (wide ridges),Alex,38.5776695,56.098293,20.77,0.25
ESP_059507_2155,Smooth area in Phlegra Montes,no,Alex,35.2320038,163.953791,4.84,0.25
ESP_059704_2165,West of Erebus Montes,no,Alex,36.2321841,185.469962,5.91,0.25
ESP_060363_2200,Candidate landing site for SpaceX Starship east,partially,Alex,39.8269895,192.063218,7.83,0.25
ESP_060429_2200,Candidate landing site for SpaceX Starship east,partially,Alex,39.8222403,192.064826,7.5,0.25
ESP_060698_2220,Crater monitoring,yes,Eldar,41.4433733,48.7745846,40.22,0.25
ESP_060707_2160,Candidate landing site for SpaceX Starship at,no,Alex,35.4936377,163.624665,2.09,0.25
ESP_060773_2160,Candidate landing site for SpaceX Starship at,no,Alex,35.4918741,163.626382,2.67,0.25
ESP_060856_2220,Pits along mound in Protonilus Mensae,yes,Eldar,41.7029504,55.5556078,14,0.25
ESP_061015_2210,Lineated valley floor material in terrain north,yes,Alex,41.2257154,34.5718695,50.57,0.5
ESP_061075_2195,Candidate landing site for SpaceX Starship in,yes. Tons and tons of fine scale circles!,Eldar,39.1718305,195.61021,31.83,0.25
ESP_061141_2195,Candidate landing site for SpaceX Starship in,maybe in upper right,Eldar,39.1766348,195.6101,36.61,0.25
ESP_061195_2170,Apron in Phlegra Montes,maybe,Alex,36.5950284,162.590797,30.75,0.25
ESP_061616_2230,Crater monitoring,(no samples identified),Alex,42.5737938,189.026801,6.09,0.25
ESP_062366_2260,Ice-filled graben,no,Alex,45.7568145,229.903779,4.43,0.25
ESP_062432_2260,Ice-filled graben,no,Alex,45.7554912,229.903073,2.7,0.25
ESP_062519_2210,Lineated valley floor material in terrain north,yes,Alex,40.4249076,15.4720522,22.57,0.25
ESP_062526_2205,Monitoring new impact site,yes,Alex,40.3279656,185.509902,56.85,0.25
ESP_062540_2165,Smooth apron in Phlegra Montes,maybe? Very linear,Alex,36.4008238,162.271534,6.02,0.25
ESP_062730_2210,Lineated valley floor material in terrain north,yes,Eldar,40.424291,15.4724996,25.48,0.25
ESP_062751_2165,Smooth apron in Phlegra Montes,maybe? Very linear,Alex,36.4034675,162.271014,5.37,0.25
ESP_062796_2210,Head of Mamers Valles,yes,Eldar,40.5599509,11.5994617,7.03,0.25
ESP_062830_2155,Smooth area in Phlegra Montes,Maybe (Alex: no),Eldar (Alex),35.0987134,164.04301,44.4,0.25
ESP_062877_2230,Pitted cones on ridge in Chryse Planitia,no,Kyle,42.8067898,319.482969,4.58,0.25
ESP_062943_2230,Pitted cones on ridge in Chryse Planitia,no,Kyle,42.8012516,319.484672,3.63,0.25
ESP_062968_1505,Flat-topped ridge and flat-topped circular butte,no,Kyle,-29.048926,5.32767194,7.25,0.5
ESP_063334_2140,Slopes of very fresh 10-km crater in Utopia,no,Kyle,33.6025361,84.1415511,3.24,0.25
ESP_063823_2210,Debris flow,no,Alex,40.87064,51.3973511,3.35,0.25
ESP_063930_2125,Candidate recent impact site,no,Kyle,32.1851999,11.7645018,15.24,0.25
ESP_064021_2235,Pits in mantle or glacier northeast of Moreux,no,Alex,43.0672433,45.6958571,8.95,0.25
ESP_064193_2235,Contact in Deuteronilus Mensae,yes,Alex,43.2750462,30.1173794,2.94,0.5
ESP_064212_2280,Monitoring well-preserved 1-km crater,no,Kyle,47.529587,229.444945,2.85,0.25
ESP_064281_1400,Volatiles and gullies,maybe,Kyle,-39.474663,158.137933,2.84,0.5
ESP_064461_1425,Crater in southern mid-latitudes,maybe,Alex,-37.286215,283.953402,13.08,0.5
ESP_064465_2155,Smooth area in Phlegra Montes,no,Alex,35.3006817,164.053524,41.24,0.25
ESP_064491_1115,Active dunes with star-shaped fans,no,Kyle,-68.153931,191.680946,4.27,0.25
ESP_064531_2155,Smooth area in Phlegra Montes,no,Alex,35.294055,164.054761,44.07,0.25
ESP_064588_2225,Ridges in valley on rim of Moreux Crater,no,Alex,42.2846639,45.8575908,2.11,0.25
ESP_064686_1405,Terrain on floor of crater in Claritas Fossae,maybe,Alex,-38.939295,261.80435,22.41,0.25
ESP_064701_1745,Terrain sample near Mangala Valles,no,Kyle,-5.6180093,207.618165,2.04,0.5
ESP_064733_2220,Brain terrain in Protonilus Mensae,Mostly yes,Alex,41.8327617,46.5616375,7.39,0.25
ESP_064768_2070,Channels in Phlegra region,no,Kyle,26.9265246,173.919101,3.82,0.5
ESP_064812_2225,Flow in Protonilus Mensae,yes,Alex,42.1200809,51.0559935,9.13,0.25
ESP_065193_1390,Apron in Hellas Montes,no,Alex,-40.571755,102.349919,2.61,0.5
ESP_065230_2170,Flow features surrounding mound in Phlegra,partially,Alex,36.6037853,161.209624,6.11,0.25
ESP_065235_2085,Monitoring new impact site,no,Kyle,28.445705,25.1956118,15.05,0.25
ESP_065710_2170,Esker candidates in Mamers Valles-Ismenius Cavus,yes,Alex,36.8283184,18.1635832,5.39,0.25
ESP_066119_2170,Esker candidates in Mamers Valles-Ismenius Cavus,yes,Alex,36.8274521,18.1625378,18.73,0.25
PSP_001334_2215,Fretted terrain valleys and apron materials,yes,Alex,40.952922,12.068385,65.58,0.25
PSP_001372_2160,Fretted terrain valleys in the Choloe Fossae,partially,Alex,35.4886593,56.7917487,16.76,0.5
PSP_001410_2210,Layered deposits in impact crater in Utopia,yes,Eldar,40.8039701,99.4955694,33.25,0.25
PSP_001426_2200,Lobate feature in Deuteronilus Mensae region,yes but not everywhere that it thinks,Eldar,39.8089132,23.0702147,21.83,0.25
PSP_001466_2215,Fretted terrain valleys and apron materials,maybe (likely),Kyle,40.9578429,12.0722982,62.2,0.25
PSP_001528_2210,Kufra Crater gullies with diverse rock,yes,Alex,40.5843724,120.111838,11.58,0.25
PSP_001564_2015,Flow of apron material around large blocks,no,Kyle,22.9666464,220.814969,8.68,0.25
PSP_001570_2215,Lobate debris apron,yes but not everywhere that it thinks,Alex,40.9993541,54.6235618,8.26,0.25
PSP_001630_1510,Zumba Crater: fresh crater with impressive,no,Kyle,-28.668128,227.011308,2.67,0.25
PSP_001674_1610,Sample high thermal inertia area northwest of,no,Kyle,-18.792731,105.026352,2.24,0.25
PSP_001768_2160,Juncture of valleys with lineated fill as seen in,no,Alex,35.5578686,56.6055029,46.76,0.25
PSP_001834_2215,Lobate debris apron,yes,Alex,41.0036922,54.610506,12.36,0.25
PSP_001858_2195,Gullies cutting southeast-facing slope of impact,no,Alex,39.1780373,116.406791,10.73,0.25
PSP_001914_2185,Closed fretted terrain valley,yes but not everywhere that it thinks,Alex,38.2623788,28.3621334,12.82,0.25
PSP_002046_2180,Boulders at base of fretted valley in,yes,Alex,37.7429161,24.3369469,35.37,0.25
PSP_002096_2210,Layered deposits in impact crater in Utopia,maybe,Alex,40.8086757,99.4883228,48.63,0.25
PSP_002099_2125,Fretted terrain channel,yes,Alex,32.0106938,18.5136223,5.54,0.25
PSP_002175_2210,Layered deposits in impact crater in Utopia,yes,Alex,40.7967332,99.4952379,22.92,0.25
PSP_002202_2250,Pits and cracks and polygons,(no samples identified)44.7250301,84.4408159,3.8,0.25
PSP_002214_2210,Kufra Crater gullies with diverse rock,yes,Alex,40.590387,120.115229,17.15,0.25
PSP_002327_2205,Ponded dark slope streak materials as seen in MOC,no,Kyle,40.1998953,272.170099,25.23,0.25
PSP_002413_1410,Mantling material exposed on plateau cut by cliff,no,Kyle,-38.492421,95.1754767,3.02,0.25
PSP_002632_2175,Slope streaks in Acheron Fossae,no,Alex,37.3122596,229.118182,2.02,0.25
PSP_002679_2245,Convergence of two debris aprons,maybe,Alex,44.2748951,22.1689468,3.85,0.25
PSP_002782_2230,Layered deposits within an impact crater in,yes,Alex,42.7463996,90.0340568,4.06,0.25
PSP_002902_2205,Lineated valley fill in Coloe Fossae,yes,Alex,40.1767139,53.8966149,18.12,0.25
PSP_003243_1415,Debris apron,Mostly no,Alex,-38.168861,113.157838,4.55,0.25
PSP_003245_2205,Lineated valley fill in Coloe Fossae,40.1745684,53.8602464,16.54,0.25
PSP_003514_1430,Mid-latitude mantle smooth to knobby texture,no,Alex,-36.686135,276.047472,4.02,0.5
PSP_003699_1380,Possible small channel on floor of Warrego Valles,no,Alex,-41.59639,266.860152,14.09,0.25
PSP_004097_2185,Knobs and dissected mantle in Arcadia Planitia,maybe - weird image artifacts38.1291759,190.205433,3.94,0.25
PSP_004200_1380,Warrego rise in Tharsis region,-41.863306,267.953896,4.48,0.25
PSP_004833_1400,Tharsis region - Warrego Valles rise,no,Alex,-39.769418,266.22256,9.57,0.25
PSP_004899_1380,Interesting wormy patterned gound,-41.518549,264.393907,9.55,0.25
PSP_005110_1385,Sample unusual wormy patterned ground,-41.029524,264.618466,18.98,0.25
PSP_005632_2200,Lineated valley fill in Ismeniae Fossae,39.8790968,42.4213817,7.75,0.25
PSP_005737_2185,Mound in lineated valley fill,38.3829454,56.2000662,8.18,0.25
PSP_005857_2225,Layered mesa in Deuteronilus Mensae,42.0678308,19.4740422,9.37,0.25
PSP_006213_2185,Material in Mamers Valles that seems to have,38.0229046,20.0973389,25.99,0.25
PSP_006252_2220,Canyon floor flow and debris apron,41.7449449,34.6188315,17.28,0.25
PSP_006754_2180,Dissected mantle terrain,no,Kyle,37.8417451,8.49854217,9.41,0.25
PSP_006772_1375,Layered materials and dunes on floor of crater in,no,Kyle,-42.382625,247.995004,2.87,0.25
PSP_006794_1420,Crater with central pit and tongue-shaped,maybe - eroded,Kyle,-37.787371,5.77046472,2.66,0.25
PSP_006806_2215,Lobate flow features emanating from alcoves in,no,Alex,41.1529393,29.5384806,36.5,0.25
PSP_006807_1395,Crater floor and central peak,no,Kyle,-40.028564,11.785093,4.54,0.25
PSP_006827_2210,Mound in Arcadia Planitia,40.6295352,174.429265,4.73,0.25
PSP_007096_2215,Lobate flow features emanating from alcoves in,no,Alex,41.1550621,29.5389361,36.51,0.25
PSP_007644_2190,Terrain near Erebus Montes,38.5431184,187.20442,2.2,0.25
PSP_007795_2175,Lineated valley fill in Deuteronilus Mensae,37.3557981,24.6389544,5.26,0.25
PSP_007848_2195,Aligned pits in fretted terrain,yes,Alex,39.2312997,16.7154564,30.54,0.25
PSP_008158_1825,Region North of Nicholson Crater,no,Kyle,2.22113654,196.466392,4.42,0.5
PSP_008483_2250,Aligned cratered domes in Acidalia Planitia,no,Kyle,44.4450201,316.980671,3.31,0.25
PSP_008995_2165,Possible collapsed slab along walls of Mamers,yes,Alex,36.0600153,15.5588193,7.32,0.25
PSP_009330_1875,Layering in Gigas Sulci,no,Kyle,7.58350133,232.84715,3.78,0.25
PSP_009437_2190,Mounds in Erebus Montes,no,Kyle,38.6892504,187.622356,26.07,0.25
PSP_009535_2240,Merging lobate debris aprons of Deuteronilus,43.7673186,29.3763103,2.02,0.25
PSP_009588_2175,Lineated valley fill in Deuteronilus Mensae,37.3503206,24.6412726,9.94,0.25
PSP_009678_2220,Layered deposits in impact crater in Utopia,41.4852129,87.716024,25.71,0.25
PSP_009745_2165,Possible olivine-rich terrain,no,Kyle,35.9954692,59.6659169,2.59,0.25
PSP_009747_2180,Patterned ground,37.6085477,4.51710001,14.92,0.25
PSP_009754_2205,Thermal boundary,40.3308628,172.950933,15.45,0.25
PSP_009799_2205,Lobate debris apron feature in the Deuteronilus,40.3210538,23.7893492,32.49,0.25
PSP_009839_2160,Possible phyllosilicates in Mamers Valles region,35.4635121,13.4739181,12.82,0.25
PSP_009956_2160,Merging fretted terrain valleys of Coloe Fossae,no,Alex,35.7148365,56.4795882,16.89,0.25
PSP_010159_2270,Debris apron surface texture,yes,Alex,46.8121846,275.722868,41.54,0.5
PSP_010225_2235,Rim of eroded crater near Reykholt Crater,43.1177152,273.723243,8.03,0.25
PSP_010320_1780,Arcuate ridges in Medusae Fossae Formation,no,Kyle,-2.0915181,206.010842,2.46,0.25
PSP_010346_1570,Graben in Memnonia Fossae,no,Kyle,-23.01252,219.606005,4.79,0.5
PSP_010366_2155,Sample of landforms in Viking images 231S33 and,yes,Kyle,35.3195233,25.5012326,50.4,0.25
PSP_010439_2430,Sample of possible olivine-rich terrain,no,Alex,63.0573477,187.218522,7.91,0.25
PSP_010788_2165,Very fresh small impact crater,mostly no - maybe one eroded tile,Kyle,36.0613807,23.3296858,5.63,0.25